Disease,Symptoms
Typhoid,"The two major symptoms of typhoid are fever and rash. Typhoid fever is particularly high, gradually increasing over several days up to 104 degrees Fahrenheit, or 39 to 40 degrees Celsius. The rash, which does not affect every patient, consists of rose-colored spots, particularly on the neck and abdomen. Other symptoms can include: weakness, abdominal pain, constipation, headaches. Rarely, symptoms might include confusion, diarrhea, and vomiting, but this is not normally severe."
Malaria,"The symptoms of malaria typically develop within 10 days to four weeks following the infection. Common symptoms of malaria include: shaking chills that can range from moderate to severe, high fever, profuse sweating, headache, nausea, vomiting, abdominal pain, diarrhea, anemia, muscle pain, convulsions, coma and bloody stools."
Dengue fever,"If you contract dengue fever, symptoms usually begin about four to seven days after the initial infection. In many cases, symptoms will be mild. Symptoms generally last for about 10 days and can include: sudden, high fever (up to 106 degrees Fahrenheit), severe headache, swollen lymph glands, severe joint and muscle pains, skin rash (appearing between two and five days after the initial fever), mild to severe nausea, mild to severe vomiting, mild bleeding from the nose or gums, mild bruising on the skin and febrile convulsions."
Yellow Fever,"Yellow fever develops quickly, with symptoms occurring three to six days after exposure. The symptoms includes: headaches, muscle aches, joint aches, fever, flushing, a loss of appetite, shivers, backaches, decreased urination, abdominal pain and vomiting (sometimes with blood)."
Pneumonia,"Pneumonia symptoms can be mild to life-threatening. The most common symptoms of pneumonia can include: coughing that may produce phlegm (mucus), fever, sweating, and chills, shortness of breath, chest pain."
